{"role":"implementer","status":"progressed","release":"2.1.10","unit":"u1-git-fetch-and-status","portion":"u1-git-fetch-and-status/p1-l4-l4","claimed":["post-api-git-fetch","git-fetch-response","git-status-response","ac-po-pierwszym-post-api-git-fetch-z-wyn","ac-po-post-api-git-fetch-z-wynikiem-fetc","ac-po-post-api-git-fetch-z-wynikiem-fetc-2","ac-post-api-git-fetch-nie-zmienia-head","ac-post-api-git-fetch-nie-zmienia-plikow","ac-post-api-git-fetch-na-galezi-bez-upst","ac-post-api-git-fetch-przy-config-git-en","ac-post-api-git-fetch-w-detached-head-zw","ac-post-api-git-fetch-przy-nieosiagalnym","ac-post-api-git-fetch-do-remote-wymagaja","ac-post-api-git-fetch-przy-zmienionych-p","ac-post-api-git-fetch-w-trakcie-tury-age","ac-commit-wydania-uruchomiony-w-trakcie","ac-po-commicie-wydania-serwer-emituje-do","ac-gitservice-wystawia-resolvereleasecommit"],"deviations":[],"stubsOpened":[],"stubsClosed":[],"stoppedEarly":false}
