{"role":"implementer","status":"progressed","release":"2.1.8","unit":"u02-page-reactions","portion":"u02-page-reactions/p2-l2","claimed":["section:ly6bld9w","section:wwnud9yz","section:m06batch0","section:15u7sazr","section:anchnmsp","section:ps69umk4","section:5ihquut0","section:s2r014vw","section:vw6tefc6","section:g856goji","section:h556wl8s","section:m06srref","section:9cf6zu0f"],"deviations":[],"stubsOpened":[],"stubsClosed":[],"stoppedEarly":false}
