{
  "role": "implementer",
  "status": "progressed",
  "release": "2.1.8",
  "unit": "u06-discovery-references",
  "portion": "u06-discovery-references/p2-l3",
  "claimed": [
    "c4s-reader-get-page-outline",
    "c4s-reader-get-page",
    "c4s-reader-get-sections",
    "c4s-reader-overview",
    "c4s-reader-search-pages",
    "reference-tools-get-page-outline",
    "reference-tools-get-page",
    "reference-tools-get-sections",
    "reference-tools-list-pages",
    "reference-tools-search-pages",
    "ac-anchor-pochloniety-rozwinieciem-inneg",
    "ac-anchor-rodzica-i-anchor-jego-dziecka",
    "ac-body-itemu-get-page-nie-zawiera-linii",
    "ac-edges-ucietego-itemu-sa-liczone-z-pel",
    "ac-frontmatter-fields-w-odpowiedzi-get-p",
    "ac-frontmatter-raw-w-odpowiedzi-get-page",
    "ac-get-page-na-roocie-indeksowanym-zwrac",
    "ac-get-page-outline-dla-strony-ktorej-fr",
    "ac-get-page-outline-dla-strony-ktorej-fr-2",
    "ac-get-page-outline-dla-strony-z-preambu",
    "ac-get-page-outline-niesie-hash-strony-w",
    "ac-get-page-outline-zwraca-drzewo-naglow",
    "ac-get-page-po-przekroczeniu-budzetu-zwra",
    "ac-get-page-zwraca-hash-liczony-z-pelneg",
    "ac-get-sections-z-includesubtree-true-zw",
    "ac-item-pochodzacy-z-rozwiniecia-poddrze",
    "ac-item-sekcji-nadrzednej-przy-includesu",
    "ac-message-odpowiedzi-get-page-outline-d",
    "ac-message-odpowiedzi-get-page-ucietej-b",
    "ac-message-odpowiedzi-get-page-z-preambu",
    "ac-message-przy-ucieciu-sufitem-liczby-i",
    "ac-naglowek-ktoremu-indekser-nie-wstrzyk",
    "ac-obie-encje-mcp-tool-renderujace-get-p",
    "ac-odpowiedz-get-page-dla-strony-bez-tek",
    "ac-odpowiedz-get-page-outline-dla-strony",
    "ac-odpowiedz-get-page-z-preambula-ucieta",
    "ac-preambula-wieksza-niz-budzet-odpowied",
    "ac-przebieg-wyszukiwania-ktory-wyczerpie",
    "ac-przy-bledzie-skladni-yaml-frontmatter",
    "ac-przy-bledzie-skladni-yaml-frontmatter-2",
    "ac-przy-cieciu-budzetowym-drzewa-get-pag",
    "ac-przy-ucieciu-sufitem-liczby-itemow-ko",
    "ac-redakcja-strony-przekraczajacej-budze",
    "ac-rozwiniecie-dajace-wiecej-niz-50-item",
    "ac-strona-bez-zadnego-naglowka-wraca-z-g",
    "ac-uciety-outline-jest-prefiksem-drzewa",
    "ac-wezel-get-page-outline-nie-niesie-con",
    "ac-wzorzec-regex-dluzszy-niz-limit-dlugo"
  ],
  "deviations": [
    "dev-0008"
  ],
  "stubsOpened": [],
  "stubsClosed": [],
  "stoppedEarly": false
}