{
  "role": "implementer",
  "status": "progressed",
  "release": "2.1.20",
  "unit": "frontend-serving",
  "portion": "frontend-serving/p1-l4-l11",
  "claimed": [
    "get-api-plugins-frontend-manifest",
    "get-api-plugins-name-asset",
    "frontend-manifest-response",
    "plugin-frontend-asset-error",
    "ac-endpoint-manifestu-frontendu-option-b",
    "ac-frontend-bundle-esm-dist-frontend-js",
    "ac-frontend-pluginu-ktorego-backend-ma-s",
    "ac-pakiet-npm-bez-wejscia-backendowego-n",
    "ac-przy-kolizji-nazwy-pluginu-manifest-f",
    "ac-przy-kolizji-nazwy-pluginu-manifest-f-2",
    "ac-route-api-plugins-name-frontend-js-cs",
    "ac-route-assetow-pluginu-serwuje-jako-we",
    "ac-zadanie-route-u-assetow-pluginu-o-pli",
    "ac-plugin-bandlujacy-wlasna-kopie-reacta-ti",
    "ac-komponenty-pluginu-ze-zbundlowana-wla",
    "ac-build-frontendu-pluginu-wygenerowaneg"
  ],
  "deviations": ["dev-2003"],
  "stubsOpened": [],
  "stubsClosed": [],
  "stoppedEarly": false
}
