{"role":"implementer","status":"progressed","release":"2-1-54-to-2-1-55","unit":"u3-remove-bundle-archive","portion":"u3-remove-bundle-archive/p1-l1","claimed":["file-version","ac-release-snapshot-diff-bundle-restore-o"],"deviations":["dev-0001"],"stubsOpened":[],"stubsClosed":[],"stoppedEarly":false}
