{
  "role": "implementer",
  "status": "progressed",
  "release": "2.1.26",
  "unit": "u04-display-order-retire",
  "portion": "u04-display-order-retire/p1-l2-l2",
  "claimed": ["system:project-host-consolidate-order", "section:z7l89jhf"],
  "deviations": [],
  "stubsOpened": [],
  "stubsClosed": [],
  "stoppedEarly": false
}
