{
  "role": "implementer",
  "status": "progressed",
  "release": "2.1.8",
  "unit": "u03-root-registry",
  "portion": "u03-root-registry/p2-l3",
  "claimed": [
    "ac-content-i-textedits-w-update-page-sa",
    "ac-kazdy-wiersz-katalogu-l3-opisujacy-op",
    "ac-textedits-gubiacy-anchor-majacy-refer",
    "ac-update-page-bez-content-i-bez-textedi",
    "ac-update-page-w-trybie-content-ktorego",
    "ac-update-page-z-content-i-textedits-pod",
    "ac-update-page-z-textedits-podmienia-wys",
    "ac-zapis-strony-wprowadzajacy-nowy-naglo",
    "page-tools-update-page"
  ],
  "deviations": ["dev-0002", "dev-0003"],
  "stubsOpened": [],
  "stubsClosed": [],
  "stoppedEarly": false
}
