{
  "role": "implementer",
  "status": "progressed",
  "release": "2.1.28",
  "unit": "m13-detail-scaffold",
  "portion": "m13-detail-scaffold/p1-l12",
  "claimed": [
    "m13l12sc",
    "detail-panel-shell",
    "document-body",
    "field-grid",
    "field-row",
    "ac-detailpanelshell-renderuje-ostatni-cz",
    "ac-documentbody-kontrybuowany-przez-m13-e",
    "ac-fieldgrid-uklada-w-kolumne-wiersze-fi",
    "ac-fieldrow-renderuje-jeden-wiersz-pary"
  ],
  "deviations": ["dev-2808"],
  "stubsOpened": [],
  "stubsClosed": [],
  "stoppedEarly": false
}
