{
  "role": "implementer",
  "status": "progressed",
  "release": "2.1.28",
  "unit": "ui-kit-type-package",
  "portion": "ui-kit-type-package/p1-l1-l12",
  "claimed": ["encje-pluginy#c4s-plugin-host-ui-kit-components", "ui-kit-component"],
  "deviations": [],
  "stubsOpened": [],
  "stubsClosed": [],
  "stoppedEarly": false
}
