{
  "role": "implementer",
  "status": "progressed",
  "release": "2.1.28",
  "unit": "editor-bridge-singleton",
  "portion": "editor-bridge-singleton/p1-l2-l12",
  "claimed": ["m20l11sc", "nvc5wy2p", "chipprops", "rehyxchp"],
  "deviations": [],
  "stubsOpened": [],
  "stubsClosed": [],
  "stoppedEarly": false
}
