{
  "role": "implementer",
  "status": "progressed",
  "release": "2.1.26",
  "unit": "u08-entity-write-tools",
  "portion": "u08-entity-write-tools/p1-l3",
  "claimed": [
    "create-entities",
    "entity-tools-create-entities",
    "delete-entities",
    "entity-tools-delete-entities",
    "update-entities",
    "entity-tools-update-entities",
    "link-dto",
    "endpoint-tools-link-dto",
    "unlink-dto",
    "endpoint-tools-unlink-dto",
    "restore-entity-version"
  ],
  "deviations": ["dev-2602"],
  "stubsOpened": [],
  "stubsClosed": [],
  "stoppedEarly": false
}
