{
 "role": "implementer",
 "status": "progressed",
 "release": "2.1.47",
 "unit": "u4-accept-shadow",
 "portion": "u4-accept-shadow/p1-l1-l10",
 "claimed": [
  "shadow-accept-request",
  "post-api-shadow-accept",
  "accept-shadow",
  "ac-cien-dodajacy-plik-do-korzenia-releas",
  "ac-cien-modyfikujacy-istniejacy-plik-wyd",
  "ac-cien-w-konflikcie-z-masterem-accept-c",
  "ac-cien-zmieniajacy-plik-poza-korzeniami",
  "ac-committarget-mode-named-accept-target",
  "ac-count-breakdown-wydania-przyjmujacego",
  "ac-count-breakdown-wydania-przyjmujacego-2",
  "ac-drugim-rodzicem-commita-przyjecia-jes",
  "ac-expectedheadsha-rozny-od-biezacego-he",
  "ac-expectedtipsha-rozny-od-biezacego-tip",
  "ac-nazwa-zajeta-post-api-shadow-accept-z",
  "ac-nieudane-przyjecie-cienia-dodajacego",
  "ac-nieudany-commit-wydania-przyjmujacego",
  "ac-nieudany-zapis-pliku-wydania-przy-prz",
  "ac-nowy-plik-niesledzony-w-korzeniu-reje",
  "ac-odlaczony-head-accept-no-branch",
  "ac-odmowa-release-name-conflict-przy-prz",
  "ac-plik-wydania-przyjmujacego-cien-niesi",
  "ac-plik-wydania-przyjmujacego-cien-niesi-2",
  "ac-po-nieudanym-przyjeciu-entity-version",
  "ac-po-nieudanym-przyjeciu-liczba-wierszy",
  "ac-po-sync-merged-na-drugim-klonie-gdy-u",
  "ac-po-udanym-przyjeciu-drzewo-robocze-ni",
  "ac-po-udanym-przyjeciu-get-api-git-shado",
  "ac-po-udanym-przyjeciu-head-wskazuje-com",
  "ac-po-udanym-przyjeciu-ostatnia-wersja-s",
  "ac-porazka-po-scaleniu-a-przed-utworzeni",
  "ac-porazka-po-scaleniu-a-przed-utworzeni-2",
  "ac-porazka-po-scaleniu-a-przed-utworzeni-3",
  "ac-post-api-shadow-accept-z-poprawna-naz",
  "ac-przyjecie-cienia-bez-zmian-tworzy-now",
  "ac-przyjecie-w-trakcie-tury-agenta-accep",
  "ac-resolvereleasecommit-znajduje-plik-wy",
  "ac-udane-przyjecie-dodaje-dokladnie-jede",
  "ac-wersja-encji-zmienionej-przez-cien-w",
  "ac-wydanie-utworzone-przez-release-creat",
  "ac-zastage-owany-plik-spoza-korzeni-reje",
  "ac-zmodyfikowany-plik-sledzony-w-korzeni"
 ],
 "deviations": [],
 "stubsOpened": [],
 "stubsClosed": [],
 "stoppedEarly": false
}