{
  "role": "implementer",
  "status": "progressed",
  "release": "2.1.8",
  "unit": "u02-page-reactions",
  "portion": "u02-page-reactions/p6-l7",
  "claimed": ["section:o8crf4hk", "section:v9zrytp8", "section:1139tm2r"],
  "deviations": [],
  "stubsOpened": [],
  "stubsClosed": [],
  "stoppedEarly": false
}
