{
 "role": "implementer",
 "status": "progressed",
 "release": "2.1.28",
 "unit": "kit-detail-history",
 "portion": "kit-detail-history/p1-l11-l12",
 "claimed": [
  "m13l11sc",
  "diff-view",
  "doc-editor",
  "entity-detail-toolbar",
  "entity-version-history-view",
  "enum-badge-picker",
  "grouped-relation-picker",
  "references-list",
  "rich-text-field",
  "segmented-control-tabs",
  "tag-picker",
  "version-history",
  "ac-allowrestore-false-ukrywa-akcje-rest",
  "ac-badge-changedby-w-widoku-historii-ent",
  "ac-diffview-bez-niepustych-hunks-z-podan-2",
  "ac-diffview-bez-niepustych-hunks-z-podan",
  "ac-diffview-m34-experimental-renderuje-p",
  "ac-diffview-z-niepustymi-hunks-i-jednocz",
  "ac-diffview-z-pustym-propsem-hunks-renderuj",
  "ac-doceditor-m34-experimental-host-wired",
  "ac-doceditor-obsluguje-slash-commands",
  "ac-doceditor-pozwala-wstawic-odnosnik-do",
  "ac-entitydetailtoolbar-przy-operacji-dele",
  "ac-entityversionhistoryview-bez-wybranej",
  "ac-entityversionhistoryview-dla-encji-bez",
  "ac-entityversionhistoryview-ma-stability",
  "ac-entityversionhistoryview-otwarty-dla",
  "ac-entityversionhistoryview-pokazuje-w-z",
  "ac-entityversionhistoryview-przy-showrel",
  "ac-entityversionhistoryview-renderuje-kom",
  "ac-enumbadgepicker-grupa-pickers-m34-expe",
  "ac-groupedrelationpicker-grupa-pickers-m34",
  "ac-groupedrelationpicker-z-zadanym-maxheigh",
  "ac-komponent-entitydetailtoolbar-m34-e",
  "ac-komponent-referenceslist-m34-experi",
  "ac-komponent-richtextfield-m34-experim",
  "ac-komponent-segmentedcontroltabs-grupa",
  "ac-komponent-tagpicker-m34-experimenta",
  "ac-komponent-versionhistory-m34-experi",
  "ac-line-diff-w-c4s-ma-jedna-implementacje-r",
  "ac-lista-kandydatow-w-popoverze-grupy-gr",
  "ac-restore-w-entityversionhistoryview-pr",
  "ac-richtextfield-m34-experimental-render",
  "ac-richtextfield-w-trybie-readonly-rend",
  "ac-tagpicker-oncreate-dla-nazwy-dajacej-j",
  "ac-tagpicker-w-wariancie-collapsed-renderuj",
  "ac-versionhistory-bez-podanego-variant-r",
  "ac-versionhistory-w-wariancie-variant-time",
  "ac-versionhistory-z-pustym-propsem-versi",
  "ac-versionhistory-z-variant-timeline-ren",
  "ac-w-wariancie-collapsed-tagpicker-odslania",
  "ac-w-widoku-entityversionhistoryview-wers"
 ],
 "deviations": [
  "dev-2809"
 ],
 "stubsOpened": [],
 "stubsClosed": [],
 "stoppedEarly": false
}